<?xml version="1.0" encoding="UTF-8"?>
<xsd:schema xmlns:xsd="http://www.w3.org/2001/XMLSchema" xmlns:od="urn:schemas-microsoft-com:officedata">
<xsd:element name="dataroot">
<xsd:complexType>
<xsd:sequence>
<xsd:element ref="Document" minOccurs="0" maxOccurs="unbounded"/>
</xsd:sequence>
<xsd:attribute name="generated" type="xsd:dateTime"/>
</xsd:complexType>
</xsd:element>
<xsd:element name="Document">
<xsd:annotation>
<xsd:appinfo>
<od:index index-name="DocumentDocument reference" index-key="Document_x0020_reference " primary="no" unique="no" clustered="no" order="asc"/>
<od:index index-name="DocumentIndividuals named on the document" index-key="Individuals_x0020_named_x0020_on_x0020_the_x0020_document " primary="no" unique="no" clustered="no" order="asc"/>
<od:index index-name="ID" index-key="ID " primary="no" unique="no" clustered="no" order="asc"/>
<od:index index-name="Location" index-key="Location " primary="no" unique="no" clustered="no" order="asc"/>
<od:index index-name="Number of seals and blanks" index-key="Number_x0020_of_x0020_seals_x0020_and_x0020_blanks " primary="no" unique="no" clustered="no" order="asc"/>
<od:index index-name="Place" index-key="Place " primary="no" unique="no" clustered="no" order="asc"/>
<od:index index-name="PrimaryKey" index-key="Document_x0020_reference " primary="yes" unique="yes" clustered="no" order="asc"/>
<od:index index-name="Year" index-key="Memo_x0020_date " primary="no" unique="no" clustered="no" order="asc"/>
<od:tableProperty name="Orientation" type="2" value="0"/>
<od:tableProperty name="OrderByOn" type="1" value="0"/>
<od:tableProperty name="NameMap" type="11" value="CswOVQAAAABgKJ8H9pgAQpv96ri5Q0RKAAAAAKblGvlKWONAAACOAAFEAjBEAG8A
YwB1AG0AZQBuAHQAAAAAAAAAgwc2fonPY0Sn5r9dt7y1XwcAAABgKJ8H9pgAQpv9
6ri5Q0RKSQBEAAAAAAAAAPgP0xcj7fNOiMZRkGxOzfEHAAAAYCifB/aYAEKb/eq4
uUNESkQAbwBjAHUAbQBlAG4AdAAgAHIAZQBmAGUAcgBlAG4AYwBlAAAAAAAAAP7m
wYqsJLhNmJ6K376ku38HAAAAYCifB/aYAEKb/eq4uUNESkwAbwBjAGEAdABpAG8A
bgAAAAAAAACtei0JMWMKRLAIdoo3DnJ1BwAAAGAonwf2mABCm/3quLlDREpEAGUA
dABhAGMAaABlAGQAIABpAG0AcAByAGUAcwBzAGkAbwBuACAAbwByACAAYwBhAHMA
dAAAAAAAAABIKSO2MQvLR5O7E9by3ewjBwAAAGAonwf2mABCm/3quLlDREpOAHUA
bQBiAGUAcgAgAG8AZgAgAHMAZQBhAGwAcwAgAGEAbgBkACAAYgBsAGEAbgBrAHMA
AAAAAAAASH/LySYIG0yU3NmkhUGlqwcAAABgKJ8H9pgAQpv96ri5Q0RKUwBlAGEA
bABpAG4AZwAgAGMAbABhAHUAcwBlAAAAAAAAAAtg0I7ghzJLjjaEALcYtT8HAAAA
YCifB/aYAEKb/eq4uUNESkQAYQB0AGUAIAAoAE8AbABkACAAUwB0AHkAbABlACkA
AAAAAAAA1ySdOncv4UKrIUGN2TKIwwcAAABgKJ8H9pgAQpv96ri5Q0RKRABhAHQA
ZQAgACgATgBlAHcAIABTAHQAeQBsAGUAKQAAAAAAAAD6zXWNyuHjS7OFdht2vh50
BwAAAGAonwf2mABCm/3quLlDREpNAGUAbQBvACAAZABhAHQAZQAAAAAAAACbMrtE
RLfrT7dOvHkoOG6ZBwAAAGAonwf2mABCm/3quLlDREpEAG8AYwB1AG0AZQBuAHQA
IABuAG8AdABlAHMAAAAAAAAA4ioEE4NqTk+DvX5O3DMTOwcAAABgKJ8H9pgAQpv9
6ri5Q0RKUABsAGEAYwBlAAAAAAAAANnCSNr2GkNBiJCSKXnWHXsHAAAAYCifB/aY
AEKb/eq4uUNESlMAZQBhAGwAIABvAHcAbgBlAHIALwB1AHMAZQByAAAAAAAAACOy
lE0gsQtHnh1nfcKf8foHAAAAYCifB/aYAEKb/eq4uUNESkQAYQB0AGUAIAB2AGkA
ZQB3AGUAZAAAAAAAAACHO8NvXzzcQK6JYPB++VAiBwAAAGAonwf2mABCm/3quLlD
REpEAGEAdABlACAAYwBoAGUAYwBrAGUAZAAAAAAAAADBIclWgsx+Tq3Td+de3Iqv
BwAAAGAonwf2mABCm/3quLlDREpJAG4AZABpAHYAaQBkAHUAYQBsAHMAIABuAGEA
bQBlAGQAIABvAG4AIAB0AGgAZQAgAGQAbwBjAHUAbQBlAG4AdAAAAAAAAAAAAAAA
AAAAAAAAAAAAAAAADAAAAAMAAAAAAAAAAAAAAAAAAAAAAA==
"/>
<od:tableProperty name="DefaultView" type="2" value="2"/>
<od:tableProperty name="SubdatasheetName" type="10" value="[None]"/>
<od:tableProperty name="GUID" type="9" value="YCifB/aYAEKb/eq4uUNESg==
"/>
<od:tableProperty name="FrozenColumns" type="3" value="1"/>
</xsd:appinfo>
</xsd:annotation>
<xsd:complexType>
<xsd:sequence>
<xsd:element name="ID" minOccurs="1" od:jetType="autonumber" od:sqlSType="int" od:autoUnique="yes" od:nonNullable="yes" type="xsd:int">
<xsd:annotation>
<xsd:appinfo>
<od:fieldProperty name="ColumnWidth" type="3" value="615"/>
<od:fieldProperty name="ColumnOrder" type="3" value="1"/>
<od:fieldProperty name="ColumnHidden" type="1" value="0"/>
<od:fieldProperty name="GUID" type="9" value="gwc2fonPY0Sn5r9dt7y1Xw==
"/>
</xsd:appinfo>
</xsd:annotation>
</xsd:element>
<xsd:element name="Document_x0020_reference" minOccurs="0" od:jetType="text" od:sqlSType="nvarchar">
<xsd:annotation>
<xsd:appinfo>
<od:fieldProperty name="ColumnWidth" type="3" value="4965"/>
<od:fieldProperty name="ColumnOrder" type="3" value="2"/>
<od:fieldProperty name="ColumnHidden" type="1" value="0"/>
<od:fieldProperty name="Required" type="1" value="0"/>
<od:fieldProperty name="AllowZeroLength" type="1" value="0"/>
<od:fieldProperty name="DisplayControl" type="3" value="109"/>
<od:fieldProperty name="UnicodeCompression" type="1" value="1"/>
<od:fieldProperty name="IMEMode" type="2" value="0"/>
<od:fieldProperty name="IMESentenceMode" type="2" value="3"/>
<od:fieldProperty name="GUID" type="9" value="+A/TFyPt806IxlGQbE7N8Q==
"/>
</xsd:appinfo>
</xsd:annotation>
<xsd:simpleType>
<xsd:restriction base="xsd:string">
<xsd:maxLength value="255"/>
</xsd:restriction>
</xsd:simpleType>
</xsd:element>
<xsd:element name="Location" minOccurs="0" od:jetType="text" od:sqlSType="nvarchar">
<xsd:annotation>
<xsd:appinfo>
<od:fieldProperty name="ColumnWidth" type="3" value="3105"/>
<od:fieldProperty name="ColumnOrder" type="3" value="3"/>
<od:fieldProperty name="ColumnHidden" type="1" value="0"/>
<od:fieldProperty name="Required" type="1" value="0"/>
<od:fieldProperty name="AllowZeroLength" type="1" value="1"/>
<od:fieldProperty name="DisplayControl" type="3" value="109"/>
<od:fieldProperty name="IMEMode" type="2" value="0"/>
<od:fieldProperty name="IMESentenceMode" type="2" value="3"/>
<od:fieldProperty name="UnicodeCompression" type="1" value="1"/>
<od:fieldProperty name="GUID" type="9" value="/ubBiqwkuE2YnorfvqS7fw==
"/>
</xsd:appinfo>
</xsd:annotation>
<xsd:simpleType>
<xsd:restriction base="xsd:string">
<xsd:maxLength value="50"/>
</xsd:restriction>
</xsd:simpleType>
</xsd:element>
<xsd:element name="Detached_x0020_impression_x0020_or_x0020_cast" minOccurs="0" od:jetType="text" od:sqlSType="nvarchar">
<xsd:annotation>
<xsd:appinfo>
<od:fieldProperty name="ColumnWidth" type="3" value="2820"/>
<od:fieldProperty name="ColumnOrder" type="3" value="4"/>
<od:fieldProperty name="ColumnHidden" type="1" value="0"/>
<od:fieldProperty name="Required" type="1" value="0"/>
<od:fieldProperty name="AllowZeroLength" type="1" value="0"/>
<od:fieldProperty name="DisplayControl" type="3" value="109"/>
<od:fieldProperty name="UnicodeCompression" type="1" value="1"/>
<od:fieldProperty name="IMEMode" type="2" value="0"/>
<od:fieldProperty name="IMESentenceMode" type="2" value="3"/>
<od:fieldProperty name="GUID" type="9" value="rXotCTFjCkSwCHaKNw5ydQ==
"/>
</xsd:appinfo>
</xsd:annotation>
<xsd:simpleType>
<xsd:restriction base="xsd:string">
<xsd:maxLength value="255"/>
</xsd:restriction>
</xsd:simpleType>
</xsd:element>
<xsd:element name="Number_x0020_of_x0020_seals_x0020_and_x0020_blanks" minOccurs="0" od:jetType="text" od:sqlSType="nvarchar">
<xsd:annotation>
<xsd:appinfo>
<od:fieldProperty name="ColumnWidth" type="3" value="2775"/>
<od:fieldProperty name="ColumnOrder" type="3" value="5"/>
<od:fieldProperty name="ColumnHidden" type="1" value="0"/>
<od:fieldProperty name="Required" type="1" value="0"/>
<od:fieldProperty name="AllowZeroLength" type="1" value="0"/>
<od:fieldProperty name="DisplayControl" type="3" value="109"/>
<od:fieldProperty name="UnicodeCompression" type="1" value="1"/>
<od:fieldProperty name="IMEMode" type="2" value="0"/>
<od:fieldProperty name="IMESentenceMode" type="2" value="3"/>
<od:fieldProperty name="GUID" type="9" value="SCkjtjELy0eTuxPW8t3sIw==
"/>
</xsd:appinfo>
</xsd:annotation>
<xsd:simpleType>
<xsd:restriction base="xsd:string">
<xsd:maxLength value="255"/>
</xsd:restriction>
</xsd:simpleType>
</xsd:element>
<xsd:element name="Sealing_x0020_clause" minOccurs="0" od:jetType="text" od:sqlSType="nvarchar">
<xsd:annotation>
<xsd:appinfo>
<od:fieldProperty name="ColumnWidth" type="3" value="2145"/>
<od:fieldProperty name="ColumnOrder" type="3" value="6"/>
<od:fieldProperty name="ColumnHidden" type="1" value="0"/>
<od:fieldProperty name="Required" type="1" value="0"/>
<od:fieldProperty name="AllowZeroLength" type="1" value="0"/>
<od:fieldProperty name="DisplayControl" type="3" value="109"/>
<od:fieldProperty name="UnicodeCompression" type="1" value="1"/>
<od:fieldProperty name="IMEMode" type="2" value="0"/>
<od:fieldProperty name="IMESentenceMode" type="2" value="3"/>
<od:fieldProperty name="GUID" type="9" value="SH/LySYIG0yU3NmkhUGlqw==
"/>
</xsd:appinfo>
</xsd:annotation>
<xsd:simpleType>
<xsd:restriction base="xsd:string">
<xsd:maxLength value="255"/>
</xsd:restriction>
</xsd:simpleType>
</xsd:element>
<xsd:element name="Date_x0020__x0028_Old_x0020_Style_x0029_" minOccurs="0" od:jetType="datetime" od:sqlSType="datetime" type="xsd:dateTime">
<xsd:annotation>
<xsd:appinfo>
<od:fieldProperty name="ColumnWidth" type="3" value="2265"/>
<od:fieldProperty name="ColumnOrder" type="3" value="7"/>
<od:fieldProperty name="ColumnHidden" type="1" value="0"/>
<od:fieldProperty name="Required" type="1" value="0"/>
<od:fieldProperty name="IMEMode" type="2" value="0"/>
<od:fieldProperty name="IMESentenceMode" type="2" value="3"/>
<od:fieldProperty name="GUID" type="9" value="C2DQjuCHMkuONoQAtxi1Pw==
"/>
<od:fieldProperty name="Format" type="10" value="Long Date"/>
</xsd:appinfo>
</xsd:annotation>
</xsd:element>
<xsd:element name="Memo_x0020_date" minOccurs="0" od:jetType="memo" od:sqlSType="ntext">
<xsd:annotation>
<xsd:appinfo>
<od:fieldProperty name="ColumnWidth" type="3" value="4305"/>
<od:fieldProperty name="ColumnOrder" type="3" value="8"/>
<od:fieldProperty name="ColumnHidden" type="1" value="0"/>
<od:fieldProperty name="Required" type="1" value="0"/>
<od:fieldProperty name="AllowZeroLength" type="1" value="0"/>
<od:fieldProperty name="IMEMode" type="2" value="0"/>
<od:fieldProperty name="IMESentenceMode" type="2" value="3"/>
<od:fieldProperty name="UnicodeCompression" type="1" value="1"/>
<od:fieldProperty name="GUID" type="9" value="+s11jcrh40uzhXYbdr4edA==
"/>
</xsd:appinfo>
</xsd:annotation>
<xsd:simpleType>
<xsd:restriction base="xsd:string">
<xsd:maxLength value="536870910"/>
</xsd:restriction>
</xsd:simpleType>
</xsd:element>
<xsd:element name="Document_x0020_notes" minOccurs="0" od:jetType="memo" od:sqlSType="ntext">
<xsd:annotation>
<xsd:appinfo>
<od:fieldProperty name="ColumnWidth" type="3" value="13455"/>
<od:fieldProperty name="ColumnOrder" type="3" value="9"/>
<od:fieldProperty name="ColumnHidden" type="1" value="0"/>
<od:fieldProperty name="Required" type="1" value="0"/>
<od:fieldProperty name="AllowZeroLength" type="1" value="0"/>
<od:fieldProperty name="IMEMode" type="2" value="0"/>
<od:fieldProperty name="IMESentenceMode" type="2" value="3"/>
<od:fieldProperty name="UnicodeCompression" type="1" value="1"/>
<od:fieldProperty name="GUID" type="9" value="mzK7RES360+3Trx5KDhumQ==
"/>
</xsd:appinfo>
</xsd:annotation>
<xsd:simpleType>
<xsd:restriction base="xsd:string">
<xsd:maxLength value="536870910"/>
</xsd:restriction>
</xsd:simpleType>
</xsd:element>
<xsd:element name="Place" minOccurs="0" od:jetType="text" od:sqlSType="nvarchar">
<xsd:annotation>
<xsd:appinfo>
<od:fieldProperty name="ColumnWidth" type="3" value="-1"/>
<od:fieldProperty name="ColumnOrder" type="3" value="10"/>
<od:fieldProperty name="ColumnHidden" type="1" value="0"/>
<od:fieldProperty name="Required" type="1" value="0"/>
<od:fieldProperty name="AllowZeroLength" type="1" value="0"/>
<od:fieldProperty name="DisplayControl" type="3" value="109"/>
<od:fieldProperty name="UnicodeCompression" type="1" value="1"/>
<od:fieldProperty name="IMEMode" type="2" value="0"/>
<od:fieldProperty name="IMESentenceMode" type="2" value="3"/>
<od:fieldProperty name="GUID" type="9" value="4ioEE4NqTk+DvX5O3DMTOw==
"/>
</xsd:appinfo>
</xsd:annotation>
<xsd:simpleType>
<xsd:restriction base="xsd:string">
<xsd:maxLength value="255"/>
</xsd:restriction>
</xsd:simpleType>
</xsd:element>
<xsd:element name="Seal_x0020_owner_x002F_user" minOccurs="0" od:jetType="text" od:sqlSType="nvarchar">
<xsd:annotation>
<xsd:appinfo>
<od:fieldProperty name="ColumnWidth" type="3" value="2580"/>
<od:fieldProperty name="ColumnOrder" type="3" value="11"/>
<od:fieldProperty name="ColumnHidden" type="1" value="0"/>
<od:fieldProperty name="Required" type="1" value="0"/>
<od:fieldProperty name="AllowZeroLength" type="1" value="0"/>
<od:fieldProperty name="DisplayControl" type="3" value="109"/>
<od:fieldProperty name="UnicodeCompression" type="1" value="1"/>
<od:fieldProperty name="IMEMode" type="2" value="0"/>
<od:fieldProperty name="IMESentenceMode" type="2" value="3"/>
<od:fieldProperty name="GUID" type="9" value="2cJI2vYaQ0GIkJIpedYdew==
"/>
</xsd:appinfo>
</xsd:annotation>
<xsd:simpleType>
<xsd:restriction base="xsd:string">
<xsd:maxLength value="255"/>
</xsd:restriction>
</xsd:simpleType>
</xsd:element>
<xsd:element name="Date_x0020_viewed" minOccurs="0" od:jetType="text" od:sqlSType="nvarchar">
<xsd:annotation>
<xsd:appinfo>
<od:fieldProperty name="ColumnWidth" type="3" value="-1"/>
<od:fieldProperty name="ColumnOrder" type="3" value="13"/>
<od:fieldProperty name="ColumnHidden" type="1" value="0"/>
<od:fieldProperty name="Required" type="1" value="0"/>
<od:fieldProperty name="AllowZeroLength" type="1" value="1"/>
<od:fieldProperty name="DisplayControl" type="3" value="109"/>
<od:fieldProperty name="IMEMode" type="2" value="0"/>
<od:fieldProperty name="IMESentenceMode" type="2" value="3"/>
<od:fieldProperty name="UnicodeCompression" type="1" value="0"/>
<od:fieldProperty name="GUID" type="9" value="I7KUTSCxC0eeHWd9wp/x+g==
"/>
</xsd:appinfo>
</xsd:annotation>
<xsd:simpleType>
<xsd:restriction base="xsd:string">
<xsd:maxLength value="50"/>
</xsd:restriction>
</xsd:simpleType>
</xsd:element>
<xsd:element name="Date_x0020_checked" minOccurs="0" od:jetType="datetime" od:sqlSType="datetime" type="xsd:dateTime">
<xsd:annotation>
<xsd:appinfo>
<od:fieldProperty name="ColumnWidth" type="3" value="-1"/>
<od:fieldProperty name="ColumnOrder" type="3" value="14"/>
<od:fieldProperty name="ColumnHidden" type="1" value="0"/>
<od:fieldProperty name="Format" type="10" value="General Date"/>
<od:fieldProperty name="Required" type="1" value="0"/>
<od:fieldProperty name="IMEMode" type="2" value="0"/>
<od:fieldProperty name="IMESentenceMode" type="2" value="3"/>
<od:fieldProperty name="GUID" type="9" value="hzvDb1883ECuiWDwfvlQIg==
"/>
</xsd:appinfo>
</xsd:annotation>
</xsd:element>
<xsd:element name="Individuals_x0020_named_x0020_on_x0020_the_x0020_document" minOccurs="0" od:jetType="text" od:sqlSType="nvarchar">
<xsd:annotation>
<xsd:appinfo>
<od:fieldProperty name="ColumnWidth" type="3" value="12270"/>
<od:fieldProperty name="ColumnOrder" type="3" value="12"/>
<od:fieldProperty name="ColumnHidden" type="1" value="0"/>
<od:fieldProperty name="Required" type="1" value="0"/>
<od:fieldProperty name="AllowZeroLength" type="1" value="0"/>
<od:fieldProperty name="DisplayControl" type="3" value="109"/>
<od:fieldProperty name="UnicodeCompression" type="1" value="1"/>
<od:fieldProperty name="IMEMode" type="2" value="0"/>
<od:fieldProperty name="IMESentenceMode" type="2" value="3"/>
<od:fieldProperty name="GUID" type="9" value="wSHJVoLMfk6t03fnXtyKrw==
"/>
</xsd:appinfo>
</xsd:annotation>
<xsd:simpleType>
<xsd:restriction base="xsd:string">
<xsd:maxLength value="255"/>
</xsd:restriction>
</xsd:simpleType>
</xsd:element>
</xsd:sequence>
</xsd:complexType>
</xsd:element>
</xsd:schema>
