<?xml version="1.0" encoding="UTF-8"?>
<dataroot xmlns:od="urn:schemas-microsoft-com:officedata" xmlns:xsi="http://www.w3.org/2001/XMLSchema-instance"  xsi:noNamespaceSchemaLocation="Document.xsd" generated="2019-05-23T09:31:01">
<Document>
<ID>94</ID>
<Document_x0020_reference>AA. Arm. D. 29</Document_x0020_reference>
<Location>Vatican Archive</Location>
<Detached_x0020_impression_x0020_or_x0020_cast>attached impression</Detached_x0020_impression_x0020_or_x0020_cast>
<Number_x0020_of_x0020_seals_x0020_and_x0020_blanks>6; 7 lost</Number_x0020_of_x0020_seals_x0020_and_x0020_blanks>
<Sealing_x0020_clause>Sealing clause</Sealing_x0020_clause>
<Date_x0020__x0028_Old_x0020_Style_x0029_>1378-08-09T00:00:00</Date_x0020__x0028_Old_x0020_Style_x0029_>
<Memo_x0020_date>1378 9 August</Memo_x0020_date>
<Document_x0020_notes>Letters patent of thirteen cardinals at Anagni declaring Pope Urban VI an antipope and schismatic.

6 fragmentary seals attached to document, 7 lost.  Document compiled on the death of Pope Gregory.

Index entries:

ASV Indice 57, fol. 102r-102v: belonging to set of ‘Litterae patentes tresdecim Cardinalium qui Anagnae ex / istentes Vrbanum sextum decla[m]is intrusum Antipapam &amp; schismaticum et sunt plures eiusdem tenoris.’

Indice 1001, p. 241: ‘(AA. Arm. D, Caps. I, &quot;Diversa in schismate Clem. 7 et Urb. VI&quot;, fasc. 2, n. 3) «Littere / patentes tresdecim, antipapam cardinalium qui Anagniae existentes Urbanum sextum declara / runt intrusum, antipapam &amp; schismaticum.  Et sunt plures eiusdem tenoris.» Membr. / m. 0,373 (più la plica di m. 0,050) x 0,555.  Literae patentes tresdecim cardinalium / ut supra, sub eorum sigillis.  «Universis Xpi fidelibus . . . Exigit sancte et catho / lice fidei puritas . . . Datum Anagnie . . . Anno a nativitate dni Millo Trecentesi / mo Septuagesimo octavo, die nona mensis Augusti prime Indictionis . . . » / 
Sigillata con tredici sigilli in cera rossa, appesi a coda doppia con striscie dip erg. / 
1º Frammento di sigillo ogivale, in cui si veggono soltanto le teste di tre figure di santi, / nel secondo ordine. / 
2º Ogivale alquanto mutilo nei suoi angoli e negli orli.  Tipo, edicola gotica con figu / ra della Madonna col Bambino, nell’estremità superiore.  Tre figure di santi (delle qua / li quella di mezzo, verosimilmente rappresenta il protomartire S. Stefano), nel centro. / Figura di vescovo genuflesso ed orante, fra due stemmi, dei quali ne rimane uno sol / tanto, e questo consiste in un lambello e tre stele .  Questo sigillo appartiene al card. / Guglielmo di Agrifolio, giuniore del titolo di S. Stefano al Monte Celio. / 
3º Frammento di sigillo ogivale, in cui non rimane alter che una figura di vescovo oran / te e genuflesso, nell’estremità inferiore.  Della leggenda non rimangono che queste poche / lettere, e cioè : « . . . . RATI SCE CECI[lie] . . . .» (Betranti (sic) S. Cecilie . . .). / 
4º Non rimane che la striscia dip erg. Con qualche avanzo di cera rossa.
5º “		“		“		“
6º”		“		“		“
7º Striscia di perg. nella quale rimane attaccato un piccolo frammento di cera rossa. / 
8º Non rimane che la striscia di pergamena.
9º Striscia di perg. nella rimane aderente un pezzo di sigillo ogivale , in cui si vede qual / che avanzo di una figura di vescovo genuflesso, ed uno stemma un poco mutilo.  Della / leggenda non rimangono che queste poche lettere : « . . . SCI . . . .». / 
10º Altro non rimane che la striscia di perg. on qualche avanzo di cera rossa.
11º	“
12º Striscia di perg. con un frammento di sigillo, malamente impresso di modo che nulla / vi si distingue. / 
13. Striscia di pergamena. / 
Con alcune macchie prodotte dalla muffa.’</Document_x0020_notes>
<Place>College of Cardinals, Rome</Place>
<Date_x0020_viewed>10/10/2006</Date_x0020_viewed>
<Date_x0020_checked>2007-09-18T00:00:00</Date_x0020_checked>
<Individuals_x0020_named_x0020_on_x0020_the_x0020_document>Gullielmus
Bertrandus</Individuals_x0020_named_x0020_on_x0020_the_x0020_document>
</Document>
<Document>
<ID>101</ID>
<Document_x0020_reference>AA. Arm. D. 32</Document_x0020_reference>
<Location>Vatican Archive</Location>
<Detached_x0020_impression_x0020_or_x0020_cast>attached impression</Detached_x0020_impression_x0020_or_x0020_cast>
<Number_x0020_of_x0020_seals_x0020_and_x0020_blanks>5; 8 lost</Number_x0020_of_x0020_seals_x0020_and_x0020_blanks>
<Sealing_x0020_clause>Sealing clause</Sealing_x0020_clause>
<Date_x0020__x0028_Old_x0020_Style_x0029_>1378-08-09T00:00:00</Date_x0020__x0028_Old_x0020_Style_x0029_>
<Memo_x0020_date>1378 9 August</Memo_x0020_date>
<Document_x0020_notes>Letters patent of thirteen cardinals at Anagni declaring Pope Urban VI an antipope and schismatic.

Sede vacante document, possibly sealed by thirteen cardinals, though some fragments appear to be episcopal seals.

ASV Indice 57, fol. 102r-102v: belonging to set of &apos;Litterae patentes tresdecim Cardinalium qui Anagnae ex / istentes Vrbanum sextum decla[m]is intrusum Antipapam &amp; schismaticum et sunt plures eiusdem tenoris.&apos;</Document_x0020_notes>
<Place>Anagni</Place>
<Seal_x0020_owner_x002F_user>Lagier, Bertrando</Seal_x0020_owner_x002F_user>
<Date_x0020_viewed>31/10/2006</Date_x0020_viewed>
<Date_x0020_checked>2007-09-18T00:00:00</Date_x0020_checked>
<Individuals_x0020_named_x0020_on_x0020_the_x0020_document>John?; Guillaume Aigrefeuille; Betrand Lagier; Roberto di Ginevra; Hugues de Montalais; Guido di Malesset; Jean de la Grange; Pierre de Sortenac; Gerard du Puy; Guillaume Noellet; Pierre Flandin; Pierre de Vergne; Pietro di Luna;</Individuals_x0020_named_x0020_on_x0020_the_x0020_document>
</Document>
<Document>
<ID>26</ID>
<Document_x0020_reference>AA. Arm. D. 34</Document_x0020_reference>
<Location>Vatican Archive</Location>
<Detached_x0020_impression_x0020_or_x0020_cast>attached impression</Detached_x0020_impression_x0020_or_x0020_cast>
<Number_x0020_of_x0020_seals_x0020_and_x0020_blanks>1; 12 lost</Number_x0020_of_x0020_seals_x0020_and_x0020_blanks>
<Sealing_x0020_clause>Illegible</Sealing_x0020_clause>
<Date_x0020__x0028_Old_x0020_Style_x0029_>1378-08-09T00:00:00</Date_x0020__x0028_Old_x0020_Style_x0029_>
<Memo_x0020_date>1378 9 August</Memo_x0020_date>
<Document_x0020_notes>Letters patent of thirteen cardinals at Anagni declaring Pope Urban VI an antipope and schismatic.

Badly conserved and showing signs of fragmentation.  Parts illegible.  Cord tie holes suggest that 13 seals were originally appended to the document.

ASV Indice 57, fol. 102r-102v: belonging to set of &apos;Litterae patentes tresdecim Cardinalium qui Anagnae ex / istentes Vrbanum sextum decla[m]is intrusum Antipapam &amp; schismaticum et sunt plures eiusdem tenoris.&apos;</Document_x0020_notes>
<Place>Anagni</Place>
<Seal_x0020_owner_x002F_user>Malesset, Guido di</Seal_x0020_owner_x002F_user>
<Date_x0020_viewed>27/10/2006</Date_x0020_viewed>
<Date_x0020_checked>2007-09-18T00:00:00</Date_x0020_checked>
</Document>
<Document>
<ID>103</ID>
<Document_x0020_reference>AA. Arm. D. 37</Document_x0020_reference>
<Location>Vatican Archive</Location>
<Detached_x0020_impression_x0020_or_x0020_cast>attached impression</Detached_x0020_impression_x0020_or_x0020_cast>
<Number_x0020_of_x0020_seals_x0020_and_x0020_blanks>2, 10 lost, 1 detached</Number_x0020_of_x0020_seals_x0020_and_x0020_blanks>
<Sealing_x0020_clause>Sealing clause</Sealing_x0020_clause>
<Date_x0020__x0028_Old_x0020_Style_x0029_>1378-08-09T00:00:00</Date_x0020__x0028_Old_x0020_Style_x0029_>
<Memo_x0020_date>1378 9 August</Memo_x0020_date>
<Document_x0020_notes>Letters patent of thirteen cardinals at Anagni declaring Pope Urban VI an antipope and schismatic.

Document on the election of Urban VI, signed by 13 cardinals.  2 seals identified (1 present, 1 detached), a 3rd present unidentified in Sella and Laurent.

ASV Indice 57, fol. 102v: &apos;Hortatariae Cardinalium Anagniae existentium ad Vrbanum VI vt Pontificatum deponat, &amp; poenitentiam agat.&apos;</Document_x0020_notes>
<Place>Anagni</Place>
<Seal_x0020_owner_x002F_user>Aigrefeuille, Guillaume</Seal_x0020_owner_x002F_user>
<Date_x0020_viewed>27/10/2006</Date_x0020_viewed>
<Date_x0020_checked>2007-09-18T00:00:00</Date_x0020_checked>
<Individuals_x0020_named_x0020_on_x0020_the_x0020_document>Guillemus; Bertrandus; Robertus; Hugo; Johannes; Petrus; Gerardus; Petrus;</Individuals_x0020_named_x0020_on_x0020_the_x0020_document>
</Document>
<Document>
<ID>104</ID>
<Document_x0020_reference>AA. Arm. D. 38</Document_x0020_reference>
<Location>Vatican Archive</Location>
<Detached_x0020_impression_x0020_or_x0020_cast>detached impression</Detached_x0020_impression_x0020_or_x0020_cast>
<Number_x0020_of_x0020_seals_x0020_and_x0020_blanks>unknown; 1 detached</Number_x0020_of_x0020_seals_x0020_and_x0020_blanks>
<Sealing_x0020_clause>Sealing clause</Sealing_x0020_clause>
<Date_x0020__x0028_Old_x0020_Style_x0029_>1378-10-07T00:00:00</Date_x0020__x0028_Old_x0020_Style_x0029_>
<Memo_x0020_date>1378 7 October (after assumption of Clement VII (antipapa))</Memo_x0020_date>
<Document_x0020_notes>Certification and publication of the election of Pope Clement VII by twelve cardinals.

Document witnessed &apos;sub sigillis priorum n[ost]ri Collegii vii k[a]l[ens] Octobris post assumptione prefati domini n[ost]ri Clementis&apos;.

ASV Indice 57, fol. 102v: &apos;P[on]tificatio et [ . . ]bb[ . . . . . ] electionis Clementis Septimi facto Fundis per Cardinales ibi existentes.&apos;